{
  "assignment_id": "HW3",
  "student_id": "synth_hw3_trial_001",
  "seed": 8484011560364,
  "num_input_qubits": 5,
  "shots": 2048,
  "mask_q0_to_qn": [
    1,
    0,
    1,
    1,
    0
  ],
  "output_offset": 1,
  "measurement_mode": "reversed",
  "measurement_map": [
    [
      0,
      4
    ],
    [
      1,
      3
    ],
    [
      2,
      2
    ],
    [
      3,
      1
    ],
    [
      4,
      0
    ]
  ],
  "predicted_oracle_classification": "balanced",
  "expected_logical_qn_to_q0": "01101",
  "expected_display_bitstring": "10110",
  "simulator_counts": {
    "10110": 2048
  },
  "dominant_bitstring": "10110",
  "original_depth": 11,
  "transpiled_depth_simulator": 11,
  "operation_counts_simulator": {
    "h": 11,
    "measure": 5,
    "cx": 3,
    "barrier": 3,
    "x": 2
  },
  "hardware_run_completed": false,
  "hardware_backend": null,
  "hardware_job_id": null,
  "hardware_counts": {},
  "hardware_dominant_bitstring": null,
  "hardware_expected_percentage": null,
  "hardware_result_classification": null,
  "reflection_oracle_classification": "I classified the oracle as balanced because the mask [1, 0, 1, 1, 0] contains at least one 1, so the function depends on the parity of selected input bits. The output_offset is 1, which flips every oracle output, but it does not change whether the function is constant or balanced.",
  "reflection_bit_order": "The seeded measurement map is reversed, so q[0] is measured into c[4], q[1] into c[3], and so on. The logical result in q[n-1]...q[0] order is 01101, but Qiskit displays counts in c[n-1]...c[0] order, giving 10110 after applying the measurement map.",
  "reflection_hardware_noise": "I did not run the optional IBM hardware section. On real hardware I would expect gate errors, readout errors, decoherence, and crosstalk to move some shots away from the ideal bitstring, so the expected result would usually remain prominent but would not necessarily receive all shots."
}